{
  "chip_id": "PILOT_18_WEST",
  "annotation_version": "v1.0",
  "chip_annotation_status": "HAS_ANNOTATIONS",
  "annotations": [
    {
      "annotation_id": "PILOT_18_WEST_HUMA_01",
      "class_id": 3,
      "class_name": "Agricultural Fire",
      "bbox": {
        "x_min": 250,
        "y_min": 70,
        "x_max": 285,
        "y_max": 95
      },
      "geometry_confidence": "HIGH",
      "source_class_confidence": "HIGH",
      "visibility_status": "CLEAR",
      "visual_evidence": [
        "DIRECT_FIRE_VISIBLE",
        "CROPLAND_CONTEXT_VISIBLE",
        "BURN_SCAR_VISIBLE"
      ],
      "firms_relationship": "OUTSIDE_VISIBLE_OBJECT",
      "review_status": "PENDING",
      "annotator_id": "HUMAN_ANNOTATOR_01",
      "annotation_timestamp": "2026-09-29T16:33:36.255242+00:00",
      "notes": "Active crop residue burning plot in furrowed agricultural field (~1.76 km north of FIRMS coordinate)."
    }
  ],
  "context_metadata": {
    "firms_detection_id": "d92b05d94de8fc2dd77c192ac359b43348fc947a0b837299d471c16bddf4f1f6",
    "firms_latitude": 23.41807,
    "firms_longitude": 69.78631,
    "firms_acq_datetime_utc": null,
    "firms_frp": 5.4,
    "firms_pixel_coord": {
      "row": 256.0,
      "col": 256.0
    },
    "product_id": "S2C_MSIL2A_20250305T054741_N0511_R048_T42QWL_20250305T090156.SAFE",
    "tile_id": "T42QWL",
    "cloud_cover_pct": 3.32,
    "authoritative_bands": [
      "B02",
      "B03",
      "B04",
      "B11",
      "B12"
    ],
    "data_provenance": "Copernicus Data Space Ecosystem (CDSE) Sentinel-2 L2A BOA Reflectance"
  }
}