{
  "chip_id": "PILOT_16_EAST",
  "annotation_version": "v1.0",
  "chip_annotation_status": "HAS_ANNOTATIONS",
  "annotations": [
    {
      "annotation_id": "PILOT_16_EAST_HUMA_01",
      "class_id": 2,
      "class_name": "Forest Fire",
      "bbox": {
        "x_min": 260,
        "y_min": 270,
        "x_max": 290,
        "y_max": 295
      },
      "geometry_confidence": "MEDIUM",
      "source_class_confidence": "MEDIUM",
      "visibility_status": "CLEAR",
      "visual_evidence": [
        "DIRECT_FIRE_VISIBLE",
        "FOREST_CONTEXT_VISIBLE",
        "BURN_SCAR_VISIBLE"
      ],
      "firms_relationship": "NEAR_OBJECT",
      "review_status": "PENDING",
      "annotator_id": "HUMAN_ANNOTATOR_01",
      "annotation_timestamp": "2026-09-29T16:33:36.251241+00:00",
      "notes": "Active burning front and contiguous char scar in montane forest ridge (~300m southeast of FIRMS coordinate)."
    }
  ],
  "context_metadata": {
    "firms_detection_id": "3aad47444637721f599d3895bbbaa19c768fbaeb8b5c2801064d755afa63b03d",
    "firms_latitude": 21.63108,
    "firms_longitude": 97.15075,
    "firms_acq_datetime_utc": null,
    "firms_frp": 1.15,
    "firms_pixel_coord": {
      "row": 256.0,
      "col": 256.0
    },
    "product_id": "S2C_MSIL2A_20250401T035601_N0511_R004_T47QKD_20250401T091413.SAFE",
    "tile_id": "T47QKD",
    "cloud_cover_pct": 0.0,
    "authoritative_bands": [
      "B02",
      "B03",
      "B04",
      "B11",
      "B12"
    ],
    "data_provenance": "Copernicus Data Space Ecosystem (CDSE) Sentinel-2 L2A BOA Reflectance"
  }
}