{
  "chip_id": "PILOT_06_CENTRAL",
  "annotation_version": "v1.0",
  "chip_annotation_status": "HAS_ANNOTATIONS",
  "annotations": [
    {
      "annotation_id": "PILOT_06_CENTRAL_HUMA_01",
      "class_id": 2,
      "class_name": "Forest Fire",
      "bbox": {
        "x_min": 80,
        "y_min": 325,
        "x_max": 330,
        "y_max": 385
      },
      "geometry_confidence": "MEDIUM",
      "source_class_confidence": "HIGH",
      "visibility_status": "CLEAR",
      "visual_evidence": [
        "DIRECT_FIRE_VISIBLE",
        "FOREST_CONTEXT_VISIBLE"
      ],
      "firms_relationship": "OUTSIDE_VISIBLE_OBJECT",
      "review_status": "PENDING",
      "annotator_id": "HUMAN_ANNOTATOR_01",
      "annotation_timestamp": "2026-09-29T16:33:36.224716+00:00",
      "notes": "Extensive active flaming front in southern forest tract (~1.1 km south of nominal FIRMS coordinate)."
    }
  ],
  "context_metadata": {
    "firms_detection_id": "f6988c6247c2036a9a1fdfe2f9885cf20e2f4bba6eb79bddad8756ab98575702",
    "firms_latitude": 23.64083,
    "firms_longitude": 82.85873,
    "firms_acq_datetime_utc": null,
    "firms_frp": 0.43,
    "firms_pixel_coord": {
      "row": 256.0,
      "col": 256.0
    },
    "product_id": "S2A_MSIL2A_20250401T050231_N0511_R119_T44QPM_20250401T102700.SAFE",
    "tile_id": "T44QPM",
    "cloud_cover_pct": 0.0,
    "authoritative_bands": [
      "B02",
      "B03",
      "B04",
      "B11",
      "B12"
    ],
    "data_provenance": "Copernicus Data Space Ecosystem (CDSE) Sentinel-2 L2A BOA Reflectance"
  }
}