{
  "chip_id": "PILOT_01_NORTH",
  "annotation_version": "v1.0",
  "chip_annotation_status": "HAS_ANNOTATIONS",
  "annotations": [
    {
      "annotation_id": "PILOT_01_NORTH_ANN_01",
      "class_id": 3,
      "class_name": "Agricultural Fire",
      "bbox": {
        "x_min": 445,
        "y_min": 320,
        "x_max": 495,
        "y_max": 365
      },
      "geometry_confidence": "MEDIUM",
      "source_class_confidence": "MEDIUM",
      "visibility_status": "CLEAR",
      "visual_evidence": [
        "CROPLAND_CONTEXT_VISIBLE",
        "BURN_SCAR_VISIBLE"
      ],
      "firms_relationship": "NEAR_OBJECT",
      "review_status": "PENDING",
      "annotator_id": "HUMAN_ANNOTATOR_01",
      "annotation_timestamp": "2026-09-29T15:37:28.588175+00:00",
      "notes": "Observable agricultural crop residue burn patch in southeastern field parcel (~1 km southeast of FIRMS coordinate)."
    }
  ],
  "context_metadata": {
    "firms_detection_id": "8df03f53dba1675b675e3155002cd7b9a7682a8e741aefefd35702d8ae1bb0c7",
    "firms_latitude": 27.07941,
    "firms_longitude": 86.02953,
    "firms_acq_datetime_utc": null,
    "firms_frp": 0.6,
    "firms_pixel_coord": {
      "row": 256.0,
      "col": 256.0
    },
    "product_id": "S2B_MSIL2A_20250401T044659_N0511_R076_T45RUK_20250401T065324.SAFE",
    "tile_id": "T45RUK",
    "cloud_cover_pct": 0.0,
    "authoritative_bands": [
      "B02",
      "B03",
      "B04",
      "B11",
      "B12"
    ],
    "data_provenance": "Copernicus Data Space Ecosystem (CDSE) Sentinel-2 L2A BOA Reflectance"
  }
}