{
  "chip_id": "PILOT_17_WEST",
  "annotation_version": "v1.0",
  "chip_annotation_status": "HAS_ANNOTATIONS",
  "annotations": [
    {
      "annotation_id": "PILOT_17_WEST_ADJ_01",
      "class_id": 3,
      "class_name": "Agricultural Fire",
      "bbox": {
        "x_min": 166,
        "y_min": 243,
        "x_max": 199,
        "y_max": 269
      },
      "geometry_confidence": "HIGH",
      "source_class_confidence": "HIGH",
      "visibility_status": "CLEAR",
      "visual_evidence": [
        "DIRECT_FIRE_VISIBLE",
        "CROPLAND_CONTEXT_VISIBLE",
        "BURN_SCAR_VISIBLE"
      ],
      "firms_relationship": "NEAR_OBJECT",
      "review_status": "ADJUDICATED",
      "annotator_id": "SENIOR_ADJUDICATION_PANEL",
      "annotation_timestamp": "2026-09-29T16:08:22.906879+00:00",
      "notes": "Harmonized consensus bounding box and evidence tags for active agricultural crop residue burn."
    }
  ],
  "context_metadata": {
    "firms_detection_id": "0c589fed330ba817b19d007c466ee47c9dddca13c4340815fa7887c43820c6e7",
    "firms_latitude": 24.86252,
    "firms_longitude": 68.06516,
    "firms_acq_datetime_utc": null,
    "firms_frp": 5.42,
    "firms_pixel_coord": {
      "row": 256.0,
      "col": 256.0
    },
    "product_id": "S2C_MSIL2A_20250318T055701_N0511_R091_T42RVN_20250318T091613.SAFE",
    "tile_id": "T42RVN",
    "cloud_cover_pct": 4.49,
    "authoritative_bands": [
      "B02",
      "B03",
      "B04",
      "B11",
      "B12"
    ],
    "data_provenance": "Copernicus Data Space Ecosystem (CDSE) Sentinel-2 L2A BOA Reflectance"
  }
}